{
  "contractVersion": "1",
  "kind": "fixture-eligibility-assumptions",
  "notice": "INTERNAL SYNTHETIC TEST ONLY",
  "id": "fixture-review",
  "mediaContentId": "sha256:34ed051f80d6044fb6fb87a21e18027c242b463c4e7c8a648f3d43c169f60169",
  "assumptions": [
    {
      "flavor": {
        "id": "fixture-orchid",
        "revision": "test-1"
      },
      "projectionContentId": "sha256:d0e722d224dd8b66222691cb78836df693244c4c5b27be4726ebc8458007d31d",
      "canonicalArtwork": {
        "assetId": "fixture-orchid-source",
        "revision": "test-1",
        "contentId": "sha256:963a31dd59c98d1edd93a109249d23f4b174665b1b452888e2fb543227569a7f"
      },
      "artwork": {
        "assetId": "fixture-orchid-derivative",
        "revision": "test-1",
        "contentId": "sha256:abe30968e56f57f20efb530d26a1d8691d0b5dddbdc6b821b6f107a8a353bc21",
        "deliveryRef": "fixture-orchid-delivery",
        "recipe": "fixture-placeholder",
        "recipeVersion": "1",
        "parameters": {}
      },
      "use": "web",
      "validity": "eligible-at-review"
    },
    {
      "flavor": {
        "id": "fixture-coral",
        "revision": "test-1"
      },
      "projectionContentId": "sha256:8f4db4525abce7e9154dcfc89e2a529f2270ea25a52d51768a9fe16f2e96ffc3",
      "canonicalArtwork": {
        "assetId": "fixture-coral-source",
        "revision": "test-1",
        "contentId": "sha256:4435a078a11333d5f3cc43a9fd7afdf04124cb6bd9e0f05e626a2f26ba4b5e0d"
      },
      "artwork": {
        "assetId": "fixture-coral-derivative",
        "revision": "test-1",
        "contentId": "sha256:28965010f1c6bb51a8304ca8adb12990f227723307fdd7a6a8276453699c9fee",
        "deliveryRef": "fixture-coral-delivery",
        "recipe": "fixture-placeholder",
        "recipeVersion": "1",
        "parameters": {}
      },
      "use": "web",
      "validity": "eligible-at-review"
    }
  ]
}
